{
  "$schema": "https://json-schema.org/draft/2020-12/schema",
  "title": "hero_daily",
  "type": "object",
  "additionalProperties": false,
  "required": ["schema_version", "kind", "generated_at", "day", "params", "submitters", "rows"],
  "properties": {
    "schema_version": {"const": 1},
    "kind": {"const": "hero_daily"},
    "generated_at": {"type": "string", "pattern": "^\\d{4}-\\d{2}-\\d{2}T\\d{2}:\\d{2}:\\d{2}Z$"},
    "day": {"type": "string", "pattern": "^\\d{4}-\\d{2}-\\d{2}$"},
    "params": {"type": "object", "additionalProperties": false},
    "submitters": {"$ref": "#/$defs/submitters"},
    "rows": {
      "type": "array",
      "items": {
        "type": "object",
        "additionalProperties": false,
        "required": ["hero", "segment", "runs", "ten_win", "rating_delta", "rating", "rank_runs", "opponent_ranks"],
        "properties": {
          "hero": {"type": "string", "minLength": 1},
          "segment": {"enum": ["legend", "non_legend"]},
          "runs": {
            "type": "object",
            "additionalProperties": false,
            "required": ["completed", "results"],
            "properties": {
              "completed": {"$ref": "#/$defs/count"},
              "results": {"$ref": "#/$defs/results"}
            }
          },
          "ten_win": {
            "type": "object",
            "additionalProperties": false,
            "required": ["runs", "total_final_days"],
            "properties": {
              "runs": {"$ref": "#/$defs/count"},
              "total_final_days": {"$ref": "#/$defs/count"}
            }
          },
          "rating_delta": {
            "type": "object",
            "additionalProperties": false,
            "required": ["runs", "total"],
            "properties": {
              "runs": {"$ref": "#/$defs/count"},
              "total": {"type": "integer"}
            }
          },
          "rating": {
            "type": "object",
            "additionalProperties": false,
            "required": ["runs", "sum", "sum_sq"],
            "properties": {
              "runs": {"$ref": "#/$defs/count"},
              "sum": {"type": "integer"},
              "sum_sq": {"$ref": "#/$defs/count"}
            }
          },
          "rank_runs": {
            "type": "array",
            "items": {
              "type": "object",
              "additionalProperties": false,
              "required": ["rank", "runs"],
              "properties": {
                "rank": {"type": "string", "minLength": 1},
                "runs": {"$ref": "#/$defs/count"}
              }
            }
          },
          "opponent_ranks": {
            "type": "array",
            "items": {
              "type": "object",
              "additionalProperties": false,
              "required": ["rank", "decided", "wins", "losses"],
              "properties": {
                "rank": {"type": "string", "minLength": 1},
                "decided": {"$ref": "#/$defs/count"},
                "wins": {"$ref": "#/$defs/count"},
                "losses": {"$ref": "#/$defs/count"}
              }
            }
          }
        }
      }
    }
  },
  "$defs": {
    "count": {"type": "integer", "minimum": 0},
    "results": {
      "type": "object",
      "additionalProperties": false,
      "required": ["flawless", "ten_win", "wins_7_9", "wins_4_6", "wins_0_3"],
      "properties": {
        "flawless": {"$ref": "#/$defs/count"},
        "ten_win": {"$ref": "#/$defs/count"},
        "wins_7_9": {"$ref": "#/$defs/count"},
        "wins_4_6": {"$ref": "#/$defs/count"},
        "wins_0_3": {"$ref": "#/$defs/count"}
      }
    },
    "submitters": {
      "type": "object",
      "additionalProperties": false,
      "required": ["all", "by_hero"],
      "properties": {
        "all": {"$ref": "#/$defs/count"},
        "by_hero": {
          "type": "array",
          "items": {
            "type": "object",
            "additionalProperties": false,
            "required": ["hero", "submitters"],
            "properties": {
              "hero": {"type": "string", "minLength": 1},
              "submitters": {"$ref": "#/$defs/count"}
            }
          }
        }
      }
    }
  }
}
