{"day":"2026-08-10","generated_at":"2026-08-11T00:00:00Z","kind":"hero_daily","params":{},"rows":[{"hero":"Dooley","opponent_ranks":[{"decided":1095,"losses":237,"rank":"Bronze","wins":858},{"decided":1103,"losses":258,"rank":"Silver","wins":845},{"decided":3111,"losses":969,"rank":"Gold","wins":2142},{"decided":1367,"losses":558,"rank":"Diamond","wins":809},{"decided":520,"losses":227,"rank":"Legendary","wins":293}],"rank_runs":[{"rank":"Legendary","runs":600}],"rating":{"runs":600,"sum":523616,"sum_sq":459768818},"rating_delta":{"runs":600,"total":0},"runs":{"completed":600,"results":{"flawless":40,"ten_win":277,"wins_0_3":34,"wins_4_6":99,"wins_7_9":150}},"segment":"legend","ten_win":{"runs":317,"total_final_days":3913}},{"hero":"Jules","opponent_ranks":[{"decided":289,"losses":61,"rank":"Bronze","wins":228},{"decided":293,"losses":64,"rank":"Silver","wins":229},{"decided":770,"losses":257,"rank":"Gold","wins":513},{"decided":343,"losses":142,"rank":"Diamond","wins":201},{"decided":157,"losses":85,"rank":"Legendary","wins":72}],"rank_runs":[{"rank":"Legendary","runs":157}],"rating":{"runs":157,"sum":135267,"sum_sq":117139837},"rating_delta":{"runs":157,"total":0},"runs":{"completed":157,"results":{"flawless":6,"ten_win":71,"wins_0_3":16,"wins_4_6":26,"wins_7_9":38}},"segment":"legend","ten_win":{"runs":77,"total_final_days":965}},{"hero":"Karnok","opponent_ranks":[{"decided":911,"losses":197,"rank":"Bronze","wins":714},{"decided":941,"losses":257,"rank":"Silver","wins":684},{"decided":2506,"losses":872,"rank":"Gold","wins":1634},{"decided":1111,"losses":446,"rank":"Diamond","wins":665},{"decided":496,"losses":235,"rank":"Legendary","wins":261}],"rank_runs":[{"rank":"Legendary","runs":508}],"rating":{"runs":508,"sum":443508,"sum_sq":390377424},"rating_delta":{"runs":508,"total":0},"runs":{"completed":508,"results":{"flawless":28,"ten_win":191,"wins_0_3":43,"wins_4_6":96,"wins_7_9":150}},"segment":"legend","ten_win":{"runs":219,"total_final_days":2667}},{"hero":"Mak","opponent_ranks":[{"decided":1687,"losses":338,"rank":"Bronze","wins":1349},{"decided":1633,"losses":396,"rank":"Silver","wins":1237},{"decided":4628,"losses":1589,"rank":"Gold","wins":3039},{"decided":2146,"losses":904,"rank":"Diamond","wins":1242},{"decided":823,"losses":420,"rank":"Legendary","wins":403}],"rank_runs":[{"rank":"Legendary","runs":912}],"rating":{"runs":912,"sum":796846,"sum_sq":701006288},"rating_delta":{"runs":912,"total":0},"runs":{"completed":912,"results":{"flawless":27,"ten_win":433,"wins_0_3":75,"wins_4_6":173,"wins_7_9":204}},"segment":"legend","ten_win":{"runs":460,"total_final_days":5797}},{"hero":"Pygmalien","opponent_ranks":[{"decided":1152,"losses":324,"rank":"Bronze","wins":828},{"decided":1074,"losses":346,"rank":"Silver","wins":728},{"decided":3085,"losses":1179,"rank":"Gold","wins":1906},{"decided":1492,"losses":675,"rank":"Diamond","wins":817},{"decided":574,"losses":309,"rank":"Legendary","wins":265}],"rank_runs":[{"rank":"Legendary","runs":632}],"rating":{"runs":632,"sum":535625,"sum_sq":456527659},"rating_delta":{"runs":632,"total":0},"runs":{"completed":632,"results":{"flawless":17,"ten_win":246,"wins_0_3":88,"wins_4_6":150,"wins_7_9":131}},"segment":"legend","ten_win":{"runs":263,"total_final_days":3451}},{"hero":"Stelle","opponent_ranks":[{"decided":883,"losses":176,"rank":"Bronze","wins":707},{"decided":856,"losses":195,"rank":"Silver","wins":661},{"decided":2363,"losses":709,"rank":"Gold","wins":1654},{"decided":1082,"losses":430,"rank":"Diamond","wins":652},{"decided":460,"losses":208,"rank":"Legendary","wins":252}],"rank_runs":[{"rank":"Legendary","runs":480}],"rating":{"runs":480,"sum":431398,"sum_sq":390979462},"rating_delta":{"runs":480,"total":0},"runs":{"completed":480,"results":{"flawless":31,"ten_win":225,"wins_0_3":31,"wins_4_6":80,"wins_7_9":113}},"segment":"legend","ten_win":{"runs":256,"total_final_days":3140}},{"hero":"TheDragons","opponent_ranks":[{"decided":15302,"losses":2696,"rank":"Bronze","wins":12606},{"decided":15156,"losses":3241,"rank":"Silver","wins":11915},{"decided":42057,"losses":12061,"rank":"Gold","wins":29996},{"decided":19191,"losses":6779,"rank":"Diamond","wins":12412},{"decided":7952,"losses":3534,"rank":"Legendary","wins":4418}],"rank_runs":[{"rank":"Legendary","runs":8301}],"rating":{"runs":8301,"sum":7389065,"sum_sq":6619885175},"rating_delta":{"runs":8301,"total":1},"runs":{"completed":8301,"results":{"flawless":614,"ten_win":4572,"wins_0_3":403,"wins_4_6":1048,"wins_7_9":1664}},"segment":"legend","ten_win":{"runs":5186,"total_final_days":63798}},{"hero":"Vanessa","opponent_ranks":[{"decided":2961,"losses":647,"rank":"Bronze","wins":2314},{"decided":2976,"losses":716,"rank":"Silver","wins":2260},{"decided":8230,"losses":2738,"rank":"Gold","wins":5492},{"decided":3707,"losses":1500,"rank":"Diamond","wins":2207},{"decided":1523,"losses":757,"rank":"Legendary","wins":766}],"rank_runs":[{"rank":"Legendary","runs":1824}],"rating":{"runs":1824,"sum":1464462,"sum_sq":1240774270},"rating_delta":{"runs":1824,"total":0},"runs":{"completed":1824,"results":{"flawless":93,"ten_win":719,"wins_0_3":320,"wins_4_6":314,"wins_7_9":378}},"segment":"legend","ten_win":{"runs":812,"total_final_days":10024}},{"hero":"Dooley","opponent_ranks":[{"decided":7159,"losses":2588,"rank":"Bronze","wins":4571},{"decided":5340,"losses":2005,"rank":"Silver","wins":3335},{"decided":11805,"losses":5243,"rank":"Gold","wins":6562},{"decided":2416,"losses":1185,"rank":"Diamond","wins":1231},{"decided":2,"losses":1,"rank":"Legendary","wins":1}],"rank_runs":[{"rank":"Bronze","runs":213},{"rank":"Silver","runs":235},{"rank":"Gold","runs":1051},{"rank":"Diamond","runs":1025}],"rating":{"runs":2524,"sum":2019200,"sum_sq":1615360000},"rating_delta":{"runs":2524,"total":0},"runs":{"completed":2524,"results":{"flawless":59,"ten_win":646,"wins_0_3":609,"wins_4_6":622,"wins_7_9":588}},"segment":"non_legend","ten_win":{"runs":705,"total_final_days":8824}},{"hero":"Jules","opponent_ranks":[{"decided":1570,"losses":574,"rank":"Bronze","wins":996},{"decided":1258,"losses":475,"rank":"Silver","wins":783},{"decided":2753,"losses":1297,"rank":"Gold","wins":1456},{"decided":494,"losses":247,"rank":"Diamond","wins":247}],"rank_runs":[{"rank":"Bronze","runs":45},{"rank":"Silver","runs":50},{"rank":"Gold","runs":274},{"rank":"Diamond","runs":210}],"rating":{"runs":579,"sum":463200,"sum_sq":370560000},"rating_delta":{"runs":579,"total":0},"runs":{"completed":579,"results":{"flawless":8,"ten_win":149,"wins_0_3":157,"wins_4_6":146,"wins_7_9":119}},"segment":"non_legend","ten_win":{"runs":157,"total_final_days":2027}},{"hero":"Karnok","opponent_ranks":[{"decided":4156,"losses":1401,"rank":"Bronze","wins":2755},{"decided":3274,"losses":1144,"rank":"Silver","wins":2130},{"decided":8113,"losses":3566,"rank":"Gold","wins":4547},{"decided":1534,"losses":754,"rank":"Diamond","wins":780}],"rank_runs":[{"rank":"Bronze","runs":97},{"rank":"Silver","runs":101},{"rank":"Gold","runs":752},{"rank":"Diamond","runs":650}],"rating":{"runs":1600,"sum":1280000,"sum_sq":1024000000},"rating_delta":{"runs":1600,"total":0},"runs":{"completed":1600,"results":{"flawless":42,"ten_win":403,"wins_0_3":336,"wins_4_6":409,"wins_7_9":410}},"segment":"non_legend","ten_win":{"runs":445,"total_final_days":5613}},{"hero":"Mak","opponent_ranks":[{"decided":6260,"losses":2058,"rank":"Bronze","wins":4202},{"decided":5405,"losses":1924,"rank":"Silver","wins":3481},{"decided":13031,"losses":5743,"rank":"Gold","wins":7288},{"decided":2949,"losses":1435,"rank":"Diamond","wins":1514}],"rank_runs":[{"rank":"Bronze","runs":74},{"rank":"Silver","runs":165},{"rank":"Gold","runs":1061},{"rank":"Diamond","runs":1268}],"rating":{"runs":2568,"sum":2054400,"sum_sq":1643520000},"rating_delta":{"runs":2568,"total":0},"runs":{"completed":2568,"results":{"flawless":49,"ten_win":743,"wins_0_3":557,"wins_4_6":629,"wins_7_9":590}},"segment":"non_legend","ten_win":{"runs":792,"total_final_days":10133}},{"hero":"Pygmalien","opponent_ranks":[{"decided":9490,"losses":3872,"rank":"Bronze","wins":5618},{"decided":7359,"losses":3141,"rank":"Silver","wins":4218},{"decided":16304,"losses":7902,"rank":"Gold","wins":8402},{"decided":2980,"losses":1521,"rank":"Diamond","wins":1459}],"rank_runs":[{"rank":"Bronze","runs":218},{"rank":"Silver","runs":352},{"rank":"Gold","runs":1565},{"rank":"Diamond","runs":1307}],"rating":{"runs":3442,"sum":2753600,"sum_sq":2202880000},"rating_delta":{"runs":3442,"total":0},"runs":{"completed":3442,"results":{"flawless":31,"ten_win":868,"wins_0_3":1036,"wins_4_6":905,"wins_7_9":602}},"segment":"non_legend","ten_win":{"runs":899,"total_final_days":11941}},{"hero":"Stelle","opponent_ranks":[{"decided":2543,"losses":790,"rank":"Bronze","wins":1753},{"decided":2206,"losses":792,"rank":"Silver","wins":1414},{"decided":5324,"losses":2299,"rank":"Gold","wins":3025},{"decided":1191,"losses":510,"rank":"Diamond","wins":681}],"rank_runs":[{"rank":"Bronze","runs":28},{"rank":"Silver","runs":79},{"rank":"Gold","runs":416},{"rank":"Diamond","runs":511}],"rating":{"runs":1034,"sum":827200,"sum_sq":661760000},"rating_delta":{"runs":1034,"total":0},"runs":{"completed":1034,"results":{"flawless":28,"ten_win":308,"wins_0_3":197,"wins_4_6":251,"wins_7_9":250}},"segment":"non_legend","ten_win":{"runs":336,"total_final_days":4268}},{"hero":"TheDragons","opponent_ranks":[{"decided":36051,"losses":9729,"rank":"Bronze","wins":26322},{"decided":30189,"losses":9114,"rank":"Silver","wins":21075},{"decided":73940,"losses":27491,"rank":"Gold","wins":46449},{"decided":19486,"losses":8283,"rank":"Diamond","wins":11203}],"rank_runs":[{"rank":"Bronze","runs":542},{"rank":"Silver","runs":862},{"rank":"Gold","runs":4749},{"rank":"Diamond","runs":7936}],"rating":{"runs":14089,"sum":11271200,"sum_sq":9016960000},"rating_delta":{"runs":14089,"total":0},"runs":{"completed":14089,"results":{"flawless":671,"ten_win":5730,"wins_0_3":1920,"wins_4_6":2578,"wins_7_9":3190}},"segment":"non_legend","ten_win":{"ru